Mehr," Instagram  Twitter  facebook  RSS  Archive Mehr News Agency Home All News Iran World All News Asia-Pacific Eurasia Middle East Africa Europe North America South America Politics Economy Culture Technology Sports Photo Video Opinion All News Interview Op-Ed Iran to ‘firmly’ respond to any threat in NW borders Trump says 'Stop the Count' amid reports of fraud Next US admin. to surrender to Iranian nation: Rouhani COVID-19 kills almost 17 Iranians every hour Taking a look at France’s history of ‘ideological extremism’ Iran opens first phase of water transfer from Persian Gulf French FM says ‘good old times transatlantic relations’ over Iran opens first phase of water transfer from Persian Gulf Next US admin. to surrender to Iranian nation: Rouhani Global Arrogance aims to engage Muslims against each other Bosnia & Herzegovina eyes developing parl. ties with Iran Iranian envoy pays tribute to victims of Kabul terror attack Taking a look at France’s history of ‘ideological extremism’ Other News Inaugural ceremony of water transfer from Persian Gulf AFC dismisses Persepolis’ appeal over Alkasir ban Army’s ‘Armored Brigade 116’ dispatched to NW borders Maduro slams US’ giving democracy lessons to world Isfahan permanent fairground inaugurated National Guard activated amid 'violent' protests in Portland Front pages of Iran’s English-language dailies on Nov. 5 Headlines of Iran’s Persian-language dailies on Nov. 5 Briefing on Iran's daily developments Envoy meets with Iranian inmates, vows to follow up problems Iran’s newly-appointed envoy to Yemen submits credentials US presidential election country's internal affair: China VIDEO: Iranian envoy submits credentials to Yemeni official Bosnia & Herzegovina eyes developing parl. ties with Iran Iranian envoy pays tribute to victims of Kabul terror attack Sidelines of cabinet session on Wednesday Global Arrogance aims to engage Muslims against each other Trump questions accuracy of US election results US election has minor effect on West Asian policy NIDC indigenizes know-how for manufacturing highly-used parts Iranian Foreign Minister arrives in Venezuela on Wednesday TOP 10 Iran to ‘firmly’ respond to any threat in NW borders COVID-19 kills almost 17 Iranians every hour Isfahan permanent fairground inaugurated Taking a look at France’s history of ‘ideological extremism’ Next US admin. to surrender to Iranian nation: Rouhani Iran opens first phase of water transfer from Persian Gulf Coronavirus infects 8,452, kills 419 in Iran in 24 hours Baku 'highly values' Leader's remarks on Karabakh row Gen. Soleimani assassinators responsible for all ""insecurity"" IRGC unveils new smart ballistic missile launcher Interview Future of US constitutional democracy at risk as never before Eloctoral college anti-democratic aspect of US democracy Road min. to inaugurate major port projects in Chabahar Risk of US election aftermath violence can't be discounted Op-Ed Prophet Mohammad (PBUH); mercy for all The scourge of Islamophobia in France Iran-Azerbaijan relations in the post- Karabakh war period Friday prayers leaders' position on Nagorno-Karabakh conflict What is the purpose of recognizing Israel regime? Report Tracklaying of Chabahar-Zahedan railway kicks off US Embassy takeover Great Satan's defeat of Iranian nation Muslims celebrate birthday of Prophet of Islam, Imam Sadiq Martyr Fathi Shaghaghi, example of a resisting nation Iran International Dailies Front pages of Iran’s English-language dailies on Nov. 5 Front pages of Iran’s English-language dailies on Nov. 4 Front pages of Iran’s English-language dailies on Nov. 02 Front pages of Iran’s English-language dailies on Nov. 01 Front pages of Iran’s English-language dailies on Oct. 31 Cartoon Response to Macron's insult to Prophet of Mercy Latest News Iran to ‘firmly’ respond to any threat in NW borders 2020-11-05 17:47 Inaugural ceremony of water transfer from Persian Gulf 2020-11-05 17:11 AFC dismisses Persepolis’ appeal over Alkasir ban 2020-11-05 16:37 Army’s ‘Armored Brigade 116’ dispatched to NW borders 2020-11-05 15:54 Maduro slams US’ giving democracy lessons to world 2020-11-05 15:23 French FM says ‘good old times transatlantic relations’ over 2020-11-05 14:37 COVID-19 kills almost 17 Iranians every hour 2020-11-05 14:23 Isfahan permanent fairground inaugurated 2020-11-05 13:16 Taking a look at France’s history of ‘ideological extremism’ 2020-11-05 12:31 Next US admin. to surrender to Iranian nation: Rouhani 2020-11-05 11:53 National Guard activated amid 'violent' protests in Portland 2020-11-05 11:02 Iran opens first phase of water transfer from Persian Gulf 2020-11-05 10:27 Front pages of Iran’s English-language dailies on Nov. 5 2020-11-05 10:10 Headlines of Iran’s Persian-language dailies on Nov. 5 2020-11-05 10:01 Briefing on Iran's daily developments 2020-11-05 09:37 Envoy meets with Iranian inmates, vows to follow up problems 2020-11-05 05:36 Iran’s newly-appointed envoy to Yemen submits credentials 2020-11-05 02:16 US presidential election country's internal affair: China 2020-11-04 23:32 Photo Inaugural ceremony of water transfer from Persian Gulf Army’s ‘Armored Brigade 116’ dispatched to NW borders Isfahan permanent fairground inaugurated Front pages of Iran’s English-language dailies on Nov. 5 Iran’s newly-appointed envoy to Yemen submits credentials Sidelines of cabinet session on Wednesday Video National Guard activated amid 'violent' protests in Portland VIDEO: Iranian envoy submits credentials to Yemeni official VIDEO: Protesters, police scuffle in Washington Recent Trends:  Iran Prophet Muhammad Emanuel Macron Coronavirus France COVID-19 US Presidential Election 2020 Nagorno-Karabakh US Sanctions Film Festival Donald Trump Mohammad Javad Zarif Seyed Abbas Araghchi Leader of Islamic Revolution Desktop version Mobile version about us contact us"
The Atlantic,"Skip to content  Sign in  My Account  Subscribe   Dear Therapist   Crossword Puzzle   Manage Subscription  Popular Latest Politics Ideas Photo Science Culture Podcasts Health Education Planet Technology Family Projects Business Global Events Books Fiction Newsletter Play Crossword  Latest Issue Past Issues Give a Gift     Dear Therapist   Crossword Puzzle   Manage Subscription  Popular Latest   Sign In  My Account Subscribe       Trump Is Powerless to Stop the Count  David A. Graham  QAnon Is Winning  Kaitlyn Tiffany   Face the Bitter Truth  George Packer   A Look at the Future of Abortion From Colorado  Emma Green   A Large Portion of the Electorate Chose the Sociopath  Tom Nichols       A Dreadful New Peak for the American Pandemic  Robinson Meyer Alexis C. Madrigal      The Election That Could Break America  Barton Gellman  The ‘Blue Shift’ Will Decide the Election  David A. Graham   Populism Is Undefeated  Yasmeen Serhan   How Susan Collins Did It  Russell Berman   The Simple Rule That Could Keep COVID-19 Deaths Down  Sarah Zhang    The Atlantic Daily »   3 Things the Election Revealed  Caroline Mimbs Nyce  A Cold War Between Red and Blue America  Ronald Brownstein   On TV, Having Wealth Means You Get to Suffer Beautifully  Hannah Giorgis   Kill Your Gas Stove  Sabrina Imbler  Latest See all     Trump Is Powerless to Stop the Count  David A. Graham     Populism Is Undefeated  Yasmeen Serhan     QAnon Is Winning  Kaitlyn Tiffany     A Look at the Future of Abortion From Colorado  Emma Green     A Dreadful New Peak for the American Pandemic  Robinson Meyer Alexis C. Madrigal     A Large Portion of the Electorate Chose the Sociopath  Tom Nichols     A Cold War Between Red and Blue America  Ronald Brownstein     The Atlantic Daily: 3 Things the Election Revealed  Caroline Mimbs Nyce     A Single Person Could Decide the Election  Joshua Benton     How Susan Collins Did It  Russell Berman     The American System Is Broken  David Frum     Face the Bitter Truth  George Packer     The South Has Already Changed  Adam Harris     The Atlantic Daily: What Trump Could Try Next  Caroline Mimbs Nyce     The Polling Crisis Is a Catastrophe for American Democracy  David A. Graham     The President Confirms the World’s Fears  Tom McTague     The Nightmare Is Here  David A. Graham     Yitzhak Rabin and the Case for Courage  Bill Clinton     The Atlantic Daily: Our Election Night Watch Guide  Caroline Mimbs Nyce     Scenes From New Zealand  Alan Taylor     People v. Cancer  Popular See all   A Large Portion of the Electorate Chose the Sociopath  Tom Nichols   Face the Bitter Truth  George Packer   25 Feel-Good Films You’ll Want to Watch Again—and Again  David Sims   A Cold War Between Red and Blue America  Ronald Brownstein   The Polling Crisis Is a Catastrophe for American Democracy  David A. Graham   QAnon Is Winning  Kaitlyn Tiffany   An Oral History of Trump’s Bigotry  David A. Graham Adrienne Green Cullen Murphy Parker Richards   The President Confirms the World’s Fears  Tom McTague   The American System Is Broken  David Frum   The Election That Could Break America  Barton Gellman Newsletters See All See more newsletters The Atlantic Crossword Play Crossword Writers See all David A. Graham Trump Is Powerless to Stop the Count Yasmeen Serhan Populism Is Undefeated Kaitlyn Tiffany QAnon Is Winning Emma Green A Look at the Future of Abortion From Colorado Ronald Brownstein A Cold War Between Red and Blue America Caroline Mimbs Nyce The Atlantic Daily: 3 Things the Election Revealed Russell Berman How Susan Collins Did It David Frum The American System Is Broken George Packer Face the Bitter Truth Adam Harris The South Has Already Changed Tom McTague The President Confirms the World’s Fears Alan Taylor Scenes From New Zealand Podcasts See all  The Story of an Unnatural Disaster   People Need Help    Hillary Clinton  Politics A Look at the Future of Abortion From Colorado A Cold War Between Red and Blue America A Single Person Could Decide the Election Culture Is This the End of the Election Night Watch Party? How I Came to Love My Epic Quarantine Reading Project 25 Feel-Good Films You’ll Want to Watch Again—and Again Technology QAnon Is Winning The YouTuber Who Treats the Inner City Like a Safari The Internet Won’t Be the Same After Trump Ideas Trump Is Powerless to Stop the Count A Large Portion of the Electorate Chose the Sociopath The American System Is Broken Science The Pandemic Is in Uncharted Territory The Rogue Planets That Wander the Galaxy Alone Land Managers Can’t Burn the West Fast Enough Books Anthem The Books Briefing: When Poets Write Novels Early December in Croton-on-Hudson Family It’s Been 1,000 Years Since 2016 Dear Therapist: Should I Just Accept That My Relationship With My Mom Is Beyond Repair? I Wouldn’t Have My Son Without the Help of a Trump Superfan Business The Difference Between First-Degree Racism and Third-Degree Racism The Pandemic Shows Us the Genius of Supermarkets The Looming Bank Collapse Global Populism Is Undefeated The President Confirms the World’s Fears Scenes From New Zealand Health A Dreadful New Peak for the American Pandemic Trump’s Pathology Is Now Clear The Simple Rule That Could Keep COVID-19 Deaths Down Education Working for Racial Justice as a White Teacher The Children Who Desegregated America’s Schools The New York Town That Tried to Stop Desegregation Letters The Commons The Commons Teachers Respond: Should Schools Reopen? Our History Staff Careers Help Center Contact Us Atlantic Brand Partners Press Social Distance™ Floodlines The Ticket: Politics from The Atlantic Crazy/Genius Purchase Give a Gift Manage Subscription Download iOS App Newsletters        Privacy Policy Do Not Sell My Personal Information Advertising Guidelines Terms Conditions Responsible Disclosure World Edition Site Map "
Buzzfeed,"Skip To Content Homepage Quizzes TV & Movies Shopping Videos News Tasty Sign In Search BuzzFeed lol Badge Feed win Badge Feed trending Badge Feed TV & Movies Celebrity Best of the Internet Animals Music Rewind Books LGBTQNEW! Quizzes Latest Trending Food Love Trivia Quiz Party Shopping Latest Reviews Gift Guides Deals Home Clothing Gadgets Beauty PetsNEW! Video Latest Cocoa ButterNEW! Mom In Progress Worth It Unsolved True Crime Unsolved Supernatural Multiplayer Pero Like As/Is: Style BringMe: Travel Goodful: Wellness Nifty: DIY Parents Food Weddings Election 2020 Take A Smile Break Stress-Relieving TV Shows Quiz Party Comfort Food Recipes Community What is Community? Join Community! Featured Posts Leaderboard About Us Advertise Jobs Merch Newsletters Press RSS Privacy Consent Preferences User Terms Accessibility Statement Ad Choices Help Contact Sitemap BuzzFeed NewsReporting on what you care about. We hold major institutions accountable and expose wrongdoing. BuzzFeed TastySearch, watch, and cook every single Tasty recipe and video ever - all in one place! BuzzFeed GoodfulSelf care and ideas to help you live a healthier, happier life. BuzzFeed Bring MeObsessed with travel? Discover unique things to do, places to eat, and sights to see in the best destinations around the world with Bring Me! BuzzFeed As IsSomething for everyone interested in hair, makeup, style, and body positivity. Election 2020 Take A Smile Break Stress-Relieving TV Shows Quiz Party Comfort Food Recipes link 28 Products That Worked So Well They Turned Skeptics Into Believers Be the smart one in your group chat: full election coverage 🇺🇸 Pick Some Meals All Children Love And We'll Tell You What Pet You Should Get Here, Have Some Funny Tweets About The Election 24 Pictures That Pretty Much Perfectly Sum Up 2020 See all of our gifting recommendations Kat Dennings Shared A Powerful Message About Body-Shaming After Defending Billie Eilish Here Are 10 More Controversial Arguments — Who's The Jerk? Find Out The Age Of Your Tastebuds By Building A Thanksgiving Plate 16 Tweets About Lockdown 2.0 That Made Us Laugh Out Loud 21 Things That Can Keep You Seriously Engrossed For Hours Khloé Responded To A Tweet Accusing The Kardashians Of Not Doing Anything To Influence People To Vote In The Election Here's Everything That Would Happen Is ""Emily In Paris"" Was Set In London Meet Bunny, The Talking Dog That TikTok Is Obsessed With Find The Next Show To Binge On With Our TV & Movies Newsletter! 29 Products With Before-And-After Photos That Should Seriously Impress Any Dog Owner Do You Follow The Same Celebs On Instagram As Everyone Else? 37 Gifts That Say ""I Love You"" For People Who Aren't Romantic What's Your Holy Grail Skincare Product? 31 Things From Wayfair To Upgrade Your Space Without A Ton Of Work What Music Video Made You Realize How Dark A Song Was? Chrissy Teigen's Daughter Luna Pretending To Report The News Is Exactly What We All Need Right Now It's Time To Find Out Which Cat Picture Matches Your Vibe Spill The Tea: What Is The Most Thoughtful Gift Your Partner Has Ever Given You? 19 Celebrities Who Dated People Under The Age Of 18 Celebrities Are Coming Together To Make Sure Every Vote In The Election Is Counted — Here's Who's Involved And What They Said 26 Kitchen Gifts Under $10 They'll Actually Use Which Desi Household Item Are You? USPS Says It Didn’t Lose 300,000 Ballots Trump Cannot Just “Go” To The Supreme Court To Fight Election Results. Here’s What Would Need To Happen To End Up There. 17 Bathrooms That Were Apparently Designed With Chaos In Mind The US Just Hit A New Coronavirus Record: 100,000 Cases Reported In One Day Nevada, With All Due Respect, People Want You To Please Hurry The Hell Up Philadelphia Police Released Bodycam Video Of An Officer Fatally Shooting Walter Wallace Jr. 5 TV Shows To Watch If You're Looking For A Distraction Trump Supporters In Michigan Tried To Disrupt Ballot Counting Due To False Information About Election Fraud Facebook Employees Said Facebook Live Spread Election Conspiracy Theories And Russian State-Controlled Content 17 People Who Screwed Themselves Over Using The iPhone ""Live Photo"" Feature Observers Monitoring The US Vote Expressed Alarm At Trump's Election Night Comments Just A Reminder, Humans Have Been Living In This Space Lab For 20 Years Now Top Europeans Are Keeping A Close (But Horrified) Eye On Trump And The US Election Result People Are Memeing Mail-In Ballots As The Heroes Of Nov. 4 59 Fancy But Inexpensive Gifts For Everyone On Your List It Doesn’t Matter If Biden Wins — Trumpism Is Here For Good Biden Narrowly Won Wisconsin, A State That Has Been Hit Hard By COVID-19 A Mom Is Going Viral For Her Impassioned Response To Learning Her Son Voted Independent Find Out Which Element Rules You By Designing A Royal Kingdom I Am Genuinely Curious If You Like This Person Or Not 17 Kids Who Left Me Confused, Bewildered, And Laughing Until My Sides Hurt Eat Your Way Through The Whataburger Menu And We'll Guess Your Age With Astounding Accuracy Sen. Susan Collins Has Won Reelection, Defeating Democrat Sara Gideon In Maine Here Are 8 Hopeful And Interesting Things That Happened On Election Night Can You Identify These Rom-Coms Just By The Character Who Wasn't ""The One""? 30 Supremely Cozy Recipes To Make All Through November Ariana Grande Opened Up About Wearing Her Natural Hair In Private And Her New Song ""My Hair"" Figure Out What Your High School Superlative Is By Rating These Prom Trends This Is Odd, But We Know Which Disney Princess You're Most Like Based On Your Food Preferences It Might Be Early But We'll Give You A Christmas Film To Watch Based On The Meals You Choose In A Day 10 Reasons To Watch ""The Queen's Gambit"" Immediately 15 Of The Funniest TikToks About The Collective Election Anxiety We Are Feeling Right Now People Are Celebrating That Drug Legalization Won Big In Several States Listen: Lil Wayne Was Dumped For Endorsing Trump. So Maybe That’s Justice. 34 Products That Are Super Simple But Totally Genius 19 Moms Who Didn't Get To Announce Their Pregnancy Because Someone Else Did First 38 Pictures That Show Just How Boarded Up Some Of America's Cities Are If You Can Guess The Pixar Movie From Its Description On Disney+, We'll Be Very Impressed These 20 Celebrities Never Officially Endorsed Trump Or Biden — Who Do You Think They Voted For? Chrissy Teigen And John Legend Had A Super Funny Twitter Conversation Over Some Election Results What Happens If There Is A Recount In Wisconsin? This Isn't The First Time People Have Anxiously Waited For Election Returns These Are 50 Of The Easiest Questions In ""Jeopardy"" History. Can You Get Them All Correct? How Much Random Emo Knowledge Do You Have? 79 Things That Always Go Through Your Head When You Shop At Cotton On Design Your Wedding And I'll Tell You Which Season You'll Have It In Check Off All The Things You've Done And We'll Guess Whether You're The Oldest Or Youngest Sibling Pull A Tarot Card And We'll Tell You What The Universe Wants You To Know Choose Between These Bookish Aesthetics And We'll Tell You Which Library You're Most Like 18 TV Characters Who Had The Most Compelling Story Arcs Of All Time All The Best Home Deals At Walmart's Early Black Friday Sale What Role Would You Play In A Book? 15 Disney Pixar Quizzes That'll Test Everything You Know Answer These Random Questions And We'll Reveal Which Disney Pet Or Sidekick Is Your Twin Ariana Grande Shaded Dixie D'Amelio, And Dixie's Response Is Great One Day After The Election, The US Has Officially Pulled Out Of the Paris Climate Agreement 57 Practical Gifts To Get Your Parents This Year 17 Tweets About Pennsylvania To Laugh At While We Wait In Misery 21 Super-Annoying Things That Ruin Movies 100% Of The Time 17 Hilarious Tweets That Might Take Your Mind Off The Election For One Whole Moment Next page >"
New Yorker,"The New Yorker Newsletter Privacy Policy Sign in Shop  News Books & Culture Fiction & Poetry Humor & Cartoons Magazine Crossword Video Podcasts Archive Goings On Subscribe The New Yorker Subscribe Subscribe today » Our Columnists  It Isn’t Over Yet, but Joe Biden Has Ground for His Confidence John Cassidy Election 2020  Live Election Results Photo Booth  The Faces of Americans Living in Debt Margaret Talbot Daily Comment  Trump’s Election Night Remarks Made America’s Troubles Worse Amy Davidson Sorkin  The Election Results Point to a Shift in G.O.P. Identity Benjamin Wallace-Wells  Why Trump Can’t Afford to Lose Jane Mayer  Trump Remains the President of Red America Susan B. Glasser  Salem’s Disappearance and Cryptic Return Carrie Battan Download now » Annals of a Warming Planet  What the Election Means for Climate Action Bill McKibben Our Columnists  The Disbelief and Horror of Election Night Were Captured by a Russian Poet in 1933 Masha Gessen The Current  The Fight Over Election Results Begins Benjamin Wallace-Wells If U Cn Rd Ths  A Speed-Reading App Condenses the Jeffrey Epstein Saga Antonia Hitchens Annals of National Security  How a C.I.A. Coverup Targeted a Whistle-blower Ronan Farrow Crossword  A Moderately Challenging Puzzle Patrick Berry  Election 2020  The Coronavirus Crisis  Racial Injustice and Policing  Reopening and the Economy  Jelani Cobb Biden Must Defeat Not Only Trump but Trumpism All Work  Charles Bethea The Fight to Turn Georgia Blue All Work  Helen Rosner New York City Goes to the Polls All Work  Vinson Cunningham Reënacting the Trial of a Black Woman Convicted of Voter Fraud All Work More Contributors Live 2020 Presidential-Election Results Biden May Win, but Trump Remains the President of Red America Susan B. Glasser Why Trump Can’t Afford to Lose Jane Mayer Trump’s Brief Speech from the White House Made America’s Troubles Worse Amy Davidson Sorkin How the Coronavirus Hacks the Immune System James Somers Sign up for our newsletters now Daily Shouts How to Support Your Friend Who Wants to Run a Marathon  Jason Hayes Satire from The Borowitz Report Trump Asks Supreme Court to Rule That Wisconsin Is Not a State  Andy Borowitz Daily Shouts Late-Night-Anxiety Book Club  Julia Edelman Lars Kenseth Daily Cartoon Daily Cartoon: Wednesday, November 4th  Jason Adam Katzenstein Satire from The Borowitz Report Cincinnati Bengals Announce That They Have Won Super Bowl  Andy Borowitz More Stories  Goings On About Town  Crossword  Caption Contest  New Yorker Recommends Art  Pay Phones Turned Into Public Art, in “Titan” Books  Does Knowing God Just Take Practice? James Wood Dept. of Polls  In a Wisconsin Cookie Poll, Trump Wins by a Landslide Elisabeth Zerofsky Fiction  “Ghoul” George Saunders What Do Foreign Correspondents Think of the U.S.? The Surprising Animal New Yorker Cartoonists Love to Draw Voter Intimidation Returns to America More Videos The New Yorker Radio Hour Trump in Review  More Podcasts Goings On About Town The Talk of the Town Shouts & Murmurs Reporting Fiction The Critics Poems Buy the Cover  November 9, 2020 Issue Table of Contents  November 2, 2020 Issue Table of Contents  October 26, 2020 Issue Table of Contents  October 19, 2020 Issue Table of Contents Listen to the New Yorker Radio Hour Buy the Cover Play the Crossword Play the Jigsaw Puzzle News & Politics Daily Comment Our Columnists News Desk Culture Cultural Comment Culture Desk Goings On About Town The Critics Business, Science & Tech Currency Elements Humor Daily Shouts Shouts & Murmurs The Borowitz Report Cartoons Daily Cartoon Cartoon Caption Contest Cartoon Bank Books & Fiction Page-Turner Books Poems Fiction Magazine This Week's Issue Archive Subscribe Photography Photo Booth Portfolio Video Culture Humor News Politics Science & Tech Sports Podcasts The New Yorker Radio Hour Political Scene The Writer's Voice Fiction Poetry Customer Care Buy the Cover Digital Access Crossword Puzzle Jigsaw Puzzle Store RSS Site Map Newsletters The Daily The New Yorker Recommends Daily Humor John Cassidy The Borowitz Report Amy Davidson Sorkin Election 2020 Food About Us About Careers Contact FAQ Media Kit Press Accessibility Help      .a { fill:#999; } User Agreement Privacy Policy and Cookie Statement Your California Privacy Rights Ad Choices Sign in Shop News Books & Culture Fiction & Poetry Humor & Cartoons Magazine Crossword Video Podcasts Archive Goings On Privacy Policy"
